Number,Reported_Date_Time,Occurred_From_Date_Time,Location,Description,Disposition,Narrative,School_Code,latitude,longitude
2026-00002020,02/14/2026 10:13 PM,02/14/2026 10:13 PM,SIMMONS HALL,Student observed highly intoxicated and transported to the hospital,Cleared by Adult Arrest,End occurred: 02/14/2026 10:32 PM PUBLIC DRUNKENNESS LIQUOR LAW VIOLS RFA AMBULANCE ASSIST HEALTH AND SAFETY,003329,,
26HB00077,02/14/2026 10:04 PM,02/14/2026 10:04 PM,MAHANOY HOUSE,Student reported being harassed,Not Cleared,End occurred: 02/14/2026 10:14 PM DC HARASSMENT DC HARASSMENT,003329,,
26ER00048,02/14/2026 09:03 PM,02/14/2026 09:03 PM,NIAGARA HALL,Student reported a suspicious odor,Closed,End occurred: 02/14/2026 09:30 PM HEALTH AND SAFETY,003329,,
2026-00002016,02/14/2026 09:01 PM,02/09/2026 12:00 AM,THOMPSON HALL,Student reported being harassed,Open,End occurred: 02/14/2026 09:00 PM DC HARASSMENT DC STALKING VIOLENCE AGAINST WOMEN ACT,003329,,
2026-00002015,02/14/2026 08:29 PM,02/14/2026 08:25 PM,TENER HALL,Resident Assistant reported a suspicious odor,Closed,End occurred: 02/14/2026 08:42 PM HEALTH AND SAFETY,003329,,
2026-00002014,02/14/2026 08:25 PM,02/14/2026 06:00 PM,INTRAMURAL BLDG,Student reported the theft of their unsecured personal property,Not cleared,"End occurred: 02/14/2026 06:45 PM THEFT, FROM BUILDING",003329,,
PSHI-2026-02-I-133849,02/14/2026 08:17 PM,02/14/2026 06:47 PM,Hershey - Dispatched To: HMC - Emergency Department > HMC - Emergency Department,Assisted clinical staff with agitated patient.,Closed,Patient Assist/Verbal Assist,003329,,
PSHI-2026-02-I-133847,02/14/2026 05:52 PM,02/14/2026 04:45 PM,Hershey - Dispatched To: HMC - Children's Hospital - 3 > HMC - Children's Hospital - 3,Assisted clinical staff with agitated patient.,Closed,Patient Assist/Stand By,003329,,
26BW00037,02/14/2026 04:57 PM,02/14/2026 04:57 PM,COMMONS & ATHLETIC CENTER,Employee reported disorderly persons,Not Cleared,End occurred: 02/14/2026 05:58 PM DISORDERLY CONDUCT DISORDERLY CONDUCT,003329,,
PSHI-2026-02-I-133842,02/14/2026 03:06 PM,02/14/2026 02:51 PM,Hershey - Dispatched To: HMC - Emergency Department > HMC - Emergency Department,Assisted clinical staff with agitated patient.,Closed,Patient Assist/Stand By,003329,,
26AL00074,02/14/2026 02:55 PM,02/14/2026 02:55 PM,SPRUCE HALL,Visitor reported a concern for a student,Not Cleared,End occurred: 02/14/2026 04:40 PM HEALTH AND SAFETY POSS MARIJUANA,003329,,
PSHI-2026-02-I-133840,02/14/2026 02:35 PM,02/14/2026 02:21 PM,Hershey - Dispatched To: HMC - Main Hospital - 1 - Cashier's Office > HMC - Main Hospital - 1 - Cashier's Office,Assisted visitor with reclaiming their personal property.,Closed,Property Related Matter/Valuables,003329,,
2026-00002006,02/14/2026 01:03 PM,02/14/2026 03:00 AM,ROBINSON HALL,Student reported the theft of University property,Not cleared,"End occurred: 02/14/2026 07:00 AM THEFT, FROM BUILDING",003329,,
2026-00002005,02/14/2026 12:32 PM,02/14/2026 12:25 PM,CHEMICAL AND BIOMEDICAL ENGINEERING BLDG,Student reported the theft of unsecured personal property,Cleared by Adult Arrest,"End occurred: 02/14/2026 12:32 PM HEALTH AND SAFETY ROBBERY, HANDS/FISTS, MISC LOC THEFT, FROM BUILDING STOLEN PROPERTY REC/POSS/BUY DC HARASSMENT DISORDERLY CONDUCT",003329,,
26AB00067,02/14/2026 12:16 PM,02/14/2026 12:16 PM,PHYSICAL EDUCATION BUILDING,Assisted the ambulance with a medical emergency,Closed,End occurred: 02/14/2026 12:35 PM HEALTH AND SAFETY RFA AMBULANCE ASSIST,003329,,
26AB00068,02/14/2026 11:01 AM,02/14/2026 11:18 AM,LIONS GATE AT PENN STATE ABINGTON,Employee reported suspicious activity,Closed,End occurred: 02/14/2026 11:36 AM SUSPICIOUS ACTIVITY,003329,,
26BW00041,02/14/2026 10:56 AM,02/16/2026 10:56 AM,RESIDENCE HALL,Student reported they were indecently assaulted by a known person in a residence hall,Not Cleared,SEX OFFENSES - (11D),003329,,
26BK00036,02/14/2026 10:37 AM,02/14/2026 10:37 AM,HILLVALE AVE & SPOHN RD,Assisted an outside law enforcement agency with an investigation,Closed,End occurred: 02/14/2026 11:20 AM ASSIST OTHER LE AGENCY no UCR,003329,,
PSHI-2026-02-I-133831,02/14/2026 10:13 AM,02/14/2026 10:04 AM,Hershey - Dispatched To: HMC - Centerview Parking Garage > HMC - Centerview Parking Garage,Assisted in disposing lost/abandoned property.,Closed,Suspicious Activity,003329,,
PSHI-2026-02-I-133830,02/14/2026 09:46 AM,02/14/2026 09:10 AM,Hershey - Dispatched To: HMC - Main Hospital - 3 - Acute Care > HMC - Main Hospital - 3 - Acute Care,Assisted clinical staff with agitated patient.,Closed,Patient Assist/Violent Restraints,003329,,
26AL00073,02/14/2026 09:29 AM,02/13/2026 05:00 PM,OAK HALL,Employee reported damage to University property,Not Cleared,End occurred: 02/14/2026 09:29 AM CRIMINAL MISCHIEF,003329,,
PSHI-2026-02-I-133827,02/14/2026 09:25 AM,02/14/2026 09:21 AM,Hershey - Dispatched To: HMC - Main Hospital - 1 - Security Operations Center > HMC - Main Hospital - 1 - Security Operations Center,Assisted staff with stolen property.,Closed,Staff Assist,003329,,
2026-00001998,02/14/2026 08:09 AM,02/14/2026 08:09 AM,ATHERTON HALL,Student observed highly intoxicated,Exceptional Clearance - Adult,End occurred: 02/14/2026 08:49 AM HEALTH AND SAFETY LIQUOR LAW VIOLS,003329,,
26MA00003,02/14/2026 06:01 AM,02/14/2026 05:26 AM,MONT ALTO HALL,Student reported the theft of their unattended personal property,Not Cleared,"End occurred: 02/14/2026 05:29 AM THEFT, OTHER",003329,,
PSHI-2026-02-I-133819,02/14/2026 04:55 AM,02/14/2026 03:43 AM,Hershey - Dispatched To: HMC - Emergency Department > HMC - Emergency Department,Assisted clinical staff with agitated patient.,Closed,Patient Assist/Violent Restraints,003329,,
PSHI-2026-02-I-133818,02/14/2026 04:12 AM,,Hershey - Dispatched To: HMC - Emergency Department > HMC - Emergency Department,Assisted clinical staff with agitated patient.,Closed,Patient Assist/Verbal Assist,003329,,
2026-00001995,02/14/2026 03:30 AM,02/14/2026 03:30 AM,EARLE HALL,Underage student observed highly intoxicated and transported to the hospital,Exceptional Clearance-Adult,End occurred: 02/14/2026 04:28 AM HEALTH AND SAFETY HEALTH AND SAFETY LIQUOR LAW VIOLS RFA AMBULANCE ASSIST,003329,,
2026-00001994,02/14/2026 03:27 AM,02/14/2026 03:27 AM,HIBBS HALL,Underage student observed highly intoxicated and transported to the hospital,Cleared by Adult Arrest,End occurred: 02/14/2026 03:48 AM HEALTH AND SAFETY LIQUOR LAW VIOLS PUBLIC DRUNKENNESS RFA AMBULANCE ASSIST,003329,,
2026-00001993,02/14/2026 03:05 AM,02/14/2026 03:05 AM,HASTINGS HALL,Student reported damage to University property,Cleared by Adult Arrest,End occurred: 02/14/2026 03:32 AM LIQUOR LAW VIOLS CRIMINAL MISCHIEF,003329,,
26UP00735,02/14/2026 03:04 AM,02/14/2026 03:04 AM,HASTINGS HALL,Student reported damage to University property,Cleared by Adult Arrest,End occurred: 02/14/2026 03:32 AM LIQUOR LAW VIOLS CRIMINAL MISCHIEF,003329,,
PSHI-2026-02-I-133817,02/14/2026 03:02 AM,,Hershey - Dispatched To: HMC - Main Hospital > HMC - Main Hospital,Assisted clinical staff with agitated patient.,Closed,Patient Assist/Violent Restraints,003329,,
2026-00001990,02/14/2026 02:28 AM,02/14/2026 02:28 AM,SPROUL HALL,Underage student observed highly intoxicated,Exceptional Clearance-Adult,End occurred: 02/14/2026 03:05 AM HEALTH AND SAFETY LIQUOR LAW VIOLS RFA AMBULANCE ASSIST,003329,,
26SL00017,02/14/2026 02:06 AM,02/14/2026 02:06 AM,STUDENT PARKING LOT - SCHUYLKILL,Assisted a student with a personal matter,Closed,End occurred: 02/14/2026 02:38 AM HEALTH AND SAFETY,003329,,
PSHI-2026-02-I-133814,02/14/2026 01:23 AM,02/14/2026 12:15 AM,Hershey - Dispatched To: HMC - Main Hospital > HMC - Main Hospital,Assisted clinical staff with agitated patient.,Closed,Patient Assist/Restraint-Hold,003329,,
PSHI-2026-02-I-133813,02/14/2026 01:22 AM,02/14/2026 12:48 AM,Hershey - Dispatched To: HMC - Main Hospital > HMC - Main Hospital,Assisted clinical staff with explaining the smoking policy to patient.,Closed,Patient Assist/Search,003329,,
PSHI-2026-02-I-133810,02/13/2026 10:41 PM,02/13/2026 10:20 PM,Hershey - Dispatched To: HMC - Main Hospital - 4 - Neuroscience Integrated Care Unit East > HMC - Main Hospital - 4 - Neuroscience Integrated Care Unit East,Assisted LE with access to patient.,Closed,Law Enforcement Assist,003329,,
PSHI-2026-02-I-133808,02/13/2026 10:30 PM,02/13/2026 09:26 PM,Hershey - Dispatched To: HMC - Main Hospital > HMC - Main Hospital,Assisted clinical staff with agitated patient.,Closed,Patient Assist/Verbal Assist,003329,,
2026-00001981,02/13/2026 10:25 PM,02/13/2026 10:25 PM,MARTIN HALL,Student reported theft of unattended personal property,Open,"THEFT, FROM BUILDING",003329,,
2026-00001975,02/13/2026 09:45 PM,02/13/2026 09:35 PM,PARK AVE & STADIUM WEST RD,Visitor reported hit and run vehicle crash,Open,End occurred: 02/13/2026 09:45 PM VEHICLE CODE ACCIDENT,003329,,
2026-00001973,02/13/2026 09:40 PM,02/13/2026 09:40 PM,E CALDER WAY & HETZEL ST,Assisted outside law enforcement agency with an investigation,Closed,End occurred: 02/13/2026 10:00 PM ASSIST OTHER LE AGENCY no UCR,003329,,
PSHI-2026-02-I-133805,02/13/2026 09:34 PM,02/13/2026 06:50 PM,Hershey - Dispatched To: HMC - Emergency Department > HMC - Emergency Department,Assisted clinical staff with agitated patient.,Closed,Patient Assist/Restraint-Hold,003329,,
26AB00066,02/13/2026 08:00 PM,02/13/2026 08:00 PM,LIONS GATE AT PENN STATE ABINGTON,Employee reported a fire alarm activation,Closed,End occurred: 02/13/2026 08:30 PM ALARMS,003329,,
2026-00001961,02/13/2026 06:44 PM,02/13/2026 06:44 PM,EAST PARKING DECK,Employee reported a one vehicle accident with no injuries,Closed,End occurred: 02/13/2026 07:01 PM VEHICLE CODE ACCIDENT,003329,,
2026-00001960,02/13/2026 06:41 PM,02/13/2026 06:41 PM,UNIVERSITY SUPPORT BLDG I,Assisted outside law enforcement agency with an investigation,Closed,ASSIST OTHER LE AGENCY no UCR,003329,,
26BW00036,02/13/2026 06:16 PM,02/13/2026 05:40 PM,ORCHARD HALL,Assisted the ambulance with a medical emergency,Closed,End occurred: 02/13/2026 06:16 PM HEALTH AND SAFETY RFA AMBULANCE ASSIST,003329,,
2026-00001959,02/13/2026 06:15 PM,02/13/2026 06:15 PM,EAST PARKING DECK,Employee reported a one vehicle accident with no injuries,Closed,End occurred: 02/13/2026 06:44 PM VEHICLE CODE ACCIDENT,003329,,
PSHI-2026-02-I-133799,02/13/2026 05:48 PM,02/13/2026 05:39 PM,Hershey - Dispatched To: HMC - Main Hospital - 1 - Cashier's Office > HMC - Main Hospital - 1 - Cashier's Office,Assisted visitor with reclaiming of personal property.,Closed,Property Related Matter/Valuables,003329,,
PSHI-2026-02-I-133798,02/13/2026 05:35 PM,02/13/2026 05:06 PM,Hershey - Dispatched To: HMC - Children's Hospital - 4 - PIMCU > HMC - Children's Hospital - 4 - PIMCU,Assisted clinical staff with agitated visitor.,Closed,Visitor Problem,003329,,
PSHI-2026-02-I-133797,02/13/2026 05:23 PM,02/14/2026 04:00 PM,Hershey - Dispatched To: HMC Off-Site - PSMG - Elizabethtown - PSMG > HMC Off-Site - PSMG - Elizabethtown - PSMG,Assisted clinical staff with agitated patient.,Closed,Patient Assist/Stand By,003329,,
2026-00001958,02/13/2026 04:59 PM,02/13/2026 04:59 PM,SPARKS BLDG,Employee reported smoke or fire condition,Closed,End occurred: 02/13/2026 05:38 PM RFA FIRE ASSIST ALARMS HEALTH AND SAFETY,003329,,
2026-00001954,02/13/2026 03:33 PM,02/13/2026 03:33 PM,RIDER BLDG,Two vehicle crash with no injuries,Closed,End occurred: 02/13/2026 04:15 PM VEHICLE CODE ACCIDENT,003329,,
PSHI-2026-02-I-133793,02/13/2026 03:31 PM,02/13/2026 02:34 PM,Hershey - Dispatched To: HMC - UPC-1 > HMC - UPC-1,Theft of money from valet.,Review,Theft/General/Larceny,003329,,
PSHI-2026-02-I-133792,02/13/2026 02:40 PM,02/13/2026 01:59 PM,Hershey - Dispatched To: HMC - Main Hospital  > HMC - Main Hospital,Assisted clinical staff with agitated patient.,Closed,Patient Assist/Verbal Assist,003329,,
26AB00065,02/13/2026 02:31 PM,02/13/2026 02:31 PM,LARES BUILDING,Visitor reported an intrusion alarm activation,Closed,End occurred: 02/13/2026 02:46 PM ALARMS,003329,,
2026-00001953,02/13/2026 02:08 PM,02/13/2026 02:08 PM,BRILL HALL,Student reported theft of unattended university property,Unfounded,"End occurred: 02/13/2026 02:28 PM THEFT, OTHER",003329,,
26HN00013,02/13/2026 12:00 PM,02/08/2026 08:00 AM,LOT J - HAZLETON,Employee reported suspicious activity,Closed,End occurred: 02/12/2026 09:00 PM SUSPICIOUS ACTIVITY,003329,,
PSHI-2026-02-I-133783,02/13/2026 11:43 AM,02/13/2026 11:20 AM,Hershey - Dispatched To: HMC - Emergency Department > HMC - Emergency Department,Assisted clinical staff with agitated visitor.,Closed,Staff Assist,003329,,
PSHI-2026-02-I-133782,02/13/2026 11:40 AM,02/13/2026 11:31 AM,Hershey - Dispatched To: HMC - Main Hospital > HMC - Main Hospital,Assisted clinical staff with agitated patient.,Closed,Patient Assist/Stand By,003329,,
PSHI-2026-02-I-133779,02/13/2026 11:26 AM,02/13/2026 11:21 AM,Hershey - Dispatched To: HMC - Main Hospital - 1 - Rotunda Cafe > HMC - Main Hospital - 1 - Rotunda Cafe,Visitor fall.,Closed,Non-Employee/Non-Patient Injury,003329,,
PSHI-2026-02-I-133778,02/13/2026 11:24 AM,02/13/2026 10:45 AM,Hershey - Dispatched To: HMC - Main Hospital - 4 - Neuro > HMC - Main Hospital - 4 - Neuro,Patient threatened staff.,Open,Harassment/Threat,003329,,
2026-00001946,02/13/2026 10:53 AM,02/13/2026 10:53 AM,STUDENT HEALTH CENTER,Employee reported concern for a student,Closed,End occurred: 02/13/2026 11:21 AM HEALTH AND SAFETY,003329,,
PSHI-2026-02-I-133776,02/13/2026 10:35 AM,02/13/2026 10:07 AM,Hershey - Dispatched To: HMC - Centerview Parking Garage > HMC - Centerview Parking Garage,Assisted visitor with a vehicle issue.,Closed,Vehicle Assists,003329,,
26WS00006,02/13/2026 10:20 AM,02/13/2026 10:20 AM,CAMAC AVE,Employee requested assistance in locating another employee,Closed,End occurred: 02/13/2026 11:30 AM RFA ATTEMPT TO LOCATE HEALTH AND SAFETY,003329,,
PSHI-2026-02-I-133775,02/13/2026 10:09 AM,02/13/2026 09:57 AM,Hershey - Dispatched To: HMC - Main Hospital - 3 > HMC - Main Hospital - 3,Patient assaulted security officer.,Closed,"Assault/Aggravated-Hands, Fist, Feet",003329,,
26AB00064,02/13/2026 10:03 AM,02/13/2026 10:33 AM,LIONS GATE AT PENN STATE ABINGTON,Employee reported a fire alarm activation,Closed,ALARMS,003329,,
PSHI-2026-02-I-133774,02/13/2026 10:01 AM,02/13/2026 09:27 AM,Hershey - Dispatched To: HMC - UPC-1 > HMC - UPC-1,Vehicle incident in parking lot trafficway.,Closed,Vehicle Crash,003329,,
26BW00035,02/13/2026 09:19 AM,02/13/2026 09:19 AM,EDWARD S J TOMEZSKO CLASSROOM BUILDING,Employee reported suspicious activity,Closed,End occurred: 02/13/2026 10:17 AM SUSPICIOUS ACTIVITY,003329,,
26HN00012,02/13/2026 08:30 AM,02/13/2026 08:30 AM,PA-93 & I-81,Assisted an outside law enforcement agency with an investigation,Closed,End occurred: 02/13/2026 09:00 AM ASSIST OTHER LE AGENCY no UCR,003329,,
PSHI-2026-02-I-133770,02/13/2026 08:07 AM,02/13/2026 07:40 AM,Hershey - Dispatched To: HMC - Main Hospital - 1 - Security Operations Center > HMC - Main Hospital - 1 - Security Operations Center,Assisted LE with access to patient.,Closed,Law Enforcement Assist,003329,,
PSHI-2026-02-I-133767,02/13/2026 06:20 AM,02/13/2026 06:09 AM,Hershey - Dispatched To: HMC - Emergency Department > HMC - Emergency Department,Patient left care prior to discharge.,Closed,Visitor Problem,003329,,
PSHI-2026-02-I-133766,02/13/2026 05:45 AM,02/12/2026 06:23 PM,Hershey - Reported Location: HMC - Children's Hospital,Visitor mismatch to the sex offender registry.,Closed,Sex Offender Registry/False,003329,,
26BW00034,02/13/2026 05:34 AM,02/13/2026 05:34 AM,MAIN BUILDING,Employee reported an intrusion alarm activation,Closed,End occurred: 02/13/2026 05:42 AM ALARMS,003329,,
26ER00047,02/12/2026 11:57 PM,02/12/2026 11:57 PM,NIAGARA HALL,Student reported a suspicious odor,Closed,End occurred: 02/13/2026 12:10 AM HEALTH AND SAFETY,003329,,
2026-00001929,02/12/2026 08:39 PM,02/12/2026 08:39 PM,TENER HALL,"Employee reported the odor of marijuana, origin not located",Closed,End occurred: 02/12/2026 08:57 PM HEALTH AND SAFETY,003329,,
PSHI-2026-02-I-133760,02/12/2026 08:03 PM,02/12/2026 06:53 PM,Hershey - Dispatched To: HMC - Emergency Department > HMC - Emergency Department,Assisted clinical staff with agitated patient.,Closed,Patient Assist/Stand By,003329,,
PSHI-2026-02-I-133759,02/12/2026 06:48 PM,02/12/2026 05:52 PM,Hershey - Dispatched To: HMC - Emergency Department > HMC - Emergency Department,Assisted clinical staff with agitated patient.,Closed,Patient Assist/Escort,003329,,
PSHI-2026-02-I-133758,02/12/2026 06:41 PM,,Hershey - Dispatched To: HMC - 1 - Trauma Surgical Main Southeast      > HMC - 1 - Trauma Surgical Main Southeast,Assisted LE with access to patient.,Closed,Law Enforcement Assist,003329,,
2026-00001917,02/12/2026 04:41 PM,02/12/2026 05:30 AM,PHYSICAL PLANT BLDG,Employee reported suspicious activity,Closed,End occurred: 02/12/2026 04:30 PM SUSPICIOUS ACTIVITY,003329,,
PSHI-2026-02-I-133752,02/12/2026 04:23 PM,02/12/2026 04:00 PM,Hershey - Dispatched To: HMC - Emergency Department > HMC - Emergency Department,Assisted clinical staff with agitated patient.,Closed,Patient Assist/Violent Restraints,003329,,
PSHI-2026-02-I-133750,02/12/2026 02:46 PM,02/12/2026 02:33 PM,Hershey - Dispatched To: HMC - Emergency Department > HMC - Emergency Department,,Review,Patient Assist/Stand By,003329,,
2026-00001915,02/12/2026 02:36 PM,02/12/2026 02:27 PM,TENER HALL,"Employee reported the odor of marijuana, origin not located",Closed,End occurred: 02/12/2026 03:01 PM HEALTH AND SAFETY,003329,,
PSHI-2026-02-I-133749,02/12/2026 02:24 PM,,Hershey - Dispatched To: COM - College of Medicine > COM - College of Medicine,"Theft of wallet that was lost, mislaid, or delivered by mistake.",Closed,Theft/General/Larceny,003329,,
26BW00033,02/12/2026 02:03 PM,02/12/2026 02:03 PM,COMMONS & ATHLETIC CENTER,Student reported suspicious person,Closed,SUSPICIOUS ACTIVITY,003329,,
2026-00001913,02/12/2026 02:00 PM,01/26/2026 01:00 PM,NITTANY APT,Employee reported a university policy violation,Closed,"End occurred: 01/26/2026 03:00 PM ARSON, OTH RES, INHABITED RULES & REGS",003329,,
2026-00001912,02/12/2026 01:45 PM,02/09/2026 12:00 AM,UNKNOWN ON CAMPUS PROPERTY,Student reported being harassed,Not Cleared,End occurred: 02/12/2026 01:45 PM DC HARASSMENT DC STALKING,003329,,
26HB00073,02/12/2026 01:41 PM,02/11/2026 03:30 PM,OLMSTED BUILDING,Employee reported a concern for another employee,Closed,End occurred: 02/11/2026 04:00 PM DEPARTMENT INFO,003329,,
PSHI-2026-02-I-133745,02/12/2026 12:23 PM,02/12/2026 11:39 AM,Hershey - Dispatched To: HMC - Emergency Department > HMC - Emergency Department,Assisted clinical staff with agitated patient.,Closed,Patient Assist/Restraint-Hold,003329,,
26AL00072,02/12/2026 12:05 PM,02/12/2026 12:05 PM,PORT SKY CAFE,Employee reported suspicious activity,Closed,SUSPICIOUS ACTIVITY,003329,,
PSHI-2026-02-I-133744,02/12/2026 11:01 AM,02/12/2026 10:30 AM,Hershey - Dispatched To: HMC - Emergency Department > HMC - Emergency Department,Assisted clinical staff with agitated patient.,Closed,Patient Assist/Stand By,003329,,
2026-00001907,02/12/2026 10:49 AM,02/11/2026 11:15 AM,HOLUBA HALL,Visitor reported the theft of their unattended personal property,Not Cleared,"End occurred: 02/11/2026 03:00 PM THEFT, OTHER",003329,,
PSHI-2026-02-I-133743,02/12/2026 10:31 AM,02/12/2026 09:48 AM,Hershey - Dispatched To: HMC - UPC-2 - 1 - Dialysis > HMC - UPC-2 - 1 - Dialysis,Patient assaulted nurse.,Closed,"Assault/Aggravated-Hands, Fist, Feet",003329,,
PSHI-2026-02-I-133742,02/12/2026 09:54 AM,02/12/2026 09:10 AM,Hershey - Dispatched To: HMC - Emergency Department > HMC - Emergency Department,Assisted clinical staff with a visitor issue.,Closed,Patient Assist/Escort,003329,,
PSHI-2026-02-I-133741,02/12/2026 09:26 AM,02/12/2026 09:00 AM,Hershey - Dispatched To: HMC - Emergency Department > HMC - Emergency Department,Victim of violence receiving treatment.,Closed,Violence Victim/SANE,003329,,
2026-00001901,02/12/2026 09:25 AM,02/12/2026 09:21 AM,SIMMONS HALL,Employee reported a university policy violation,Closed,End occurred: 02/12/2026 10:05 AM RULES & REGS,003329,,
PSHI-2026-02-I-133740,02/12/2026 08:59 AM,,Hershey - Dispatched To: HMC - Emergency Department > HMC - Emergency Department,Assisted clinical staff with agitated patient.,Closed,Patient Assist/Search,003329,,
26HN00011,02/12/2026 08:30 AM,02/12/2026 08:30 AM,AZALEA RD,Employee requested assistance with a civil matter,Closed,RFA OTHER ASSIST OTHER LE AGENCY no UCR,003329,,
PSHI-2026-02-I-133737,02/12/2026 08:17 AM,02/12/2026 08:04 AM,Hershey - Dispatched To: HMC - Emergency Department > HMC - Emergency Department,Assisted LE with access to forensic kit.,Closed,Violence Victim/SANE,003329,,
PSHI-2026-02-I-133731,02/12/2026 03:22 AM,02/12/2026 02:54 AM,Hershey - Dispatched To: HMC - Emergency Department > HMC - Emergency Department,Intervened in patient elopement.,Closed,Patient Elopement,003329,,
26BR00008,02/12/2026 02:29 AM,02/12/2026 02:49 AM,HARMONY HALL,Student reported a concern for another student,Closed,End occurred: 02/12/2026 03:00 AM HEALTH AND SAFETY,003329,,
PSHI-2026-02-I-133729,02/12/2026 01:26 AM,02/11/2026 11:57 AM,Hershey - Reported Location: HMC - Emergency Department - 1 - Emergency Department,Patient left care prior to discharge process being completed.,Closed,Patient Elopement,003329,,
26AB00063,02/12/2026 12:50 AM,02/12/2026 12:50 AM,OLD YORK RD,Assisted an outside law enforcement agency with an investigation,Closed,End occurred: 02/12/2026 01:13 AM ASSIST OTHER LE AGENCY no UCR,003329,,
26AL00071,02/12/2026 12:48 AM,02/12/2026 12:48 AM,OAK HALL,Assisted the ambulance with a medical emergency,Closed,HEALTH AND SAFETY RFA AMBULANCE ASSIST RULES AND REGULATIONS,003329,,
PSHI-2026-02-I-133727,02/11/2026 11:27 PM,02/11/2026 08:58 PM,Hershey - Dispatched To: HMC - Main Hospital - 4 - Acute Care > HMC - Main Hospital - 4 - Acute Care,Assisted clinical staff with agitated patient.,Closed,Patient Assist/Stand By,003329,,
PSHI-2026-02-I-133728,02/11/2026 11:27 PM,02/11/2026 10:03 PM,Hershey - Dispatched To: HMC - Emergency Department > HMC - Emergency Department,Assisted clinical staff with an agitated patient.,Closed,Patient Assist/Stand By,003329,,
PSHI-2026-02-I-133725,02/11/2026 10:56 PM,02/11/2026 07:35 PM,Hershey - Dispatched To: HMC - Main Hospital - 4 - Acute Care > HMC - Main Hospital - 4 - Acute Care,Assisted clinical staff with agitated patient.,Closed,Behavioral De-escalation Team (BDRT) (BERT),003329,,
2026-00001891,02/11/2026 09:45 PM,02/11/2026 09:45 PM,MCKEAN RD & BIGLER RD,Employee reported disorderly persons,Open,End occurred: 02/12/2026 12:50 AM DISORDERLY CONDUCT,003329,,
PSHI-2026-02-I-133719,02/11/2026 09:35 PM,02/11/2026 08:42 PM,Hershey - Dispatched To: HMC - Emergency Department > HMC - Emergency Department,Assisted clinical staff with agitated patient.,Closed,Patient Assist/Violent Restraints,003329,,
2026-00001885,02/11/2026 07:53 PM,02/11/2026 07:53 PM,PATTERSON HALL,Students reported disorderly persons,Not Cleared,End occurred: 02/11/2026 08:30 PM DISORDERLY CONDUCT,003329,,
2026-00001880,02/11/2026 06:20 PM,02/11/2026 06:20 PM,UNIVERSITY SUPPORT BLDG I,Visitor reported suspicious activity,Closed,End occurred: 02/11/2026 06:53 PM HEALTH AND SAFETY SUSPICIOUS ACTIVITY,003329,,
26ER00046,02/11/2026 05:31 PM,02/11/2026 05:31 PM,SENAT HALL,Assisted the fire department with a reported fire,Closed,End occurred: 02/11/2026 06:00 PM ALARMS HEALTH AND SAFETY RFA FIRE ASSIST RULES AND REGULATIONS,003329,,
PSHI-2026-02-I-133714,02/11/2026 05:08 PM,02/11/2026 04:40 PM,Hershey - Dispatched To: HMC - UPC-1 > HMC - UPC-1,Theft of wallet.,Closed,Theft/General/Larceny,003329,,
26AB00062,02/11/2026 04:56 PM,02/11/2026 04:56 PM,SUTHERLAND BUILDING,Assisted the ambulance with a medical emergency,Closed,HEALTH AND SAFETY RFA AMBULANCE ASSIST,003329,,
PSHI-2026-02-I-133705,02/11/2026 01:58 PM,,Hershey - Dispatched To: HMC - Main Hospital - 6 - Acute Care > HMC - Main Hospital - 6 - Acute Care,Assisted clinical staff with agitated patient.,Closed,Patient Assist/Violent Restraints,003329,,
PSHI-2026-02-I-133704,02/11/2026 01:34 PM,02/11/2026 01:20 PM,Hershey - Dispatched To: COM - College of Medicine - 1 > COM - College of Medicine - 1,Vetted suspicious activity.,Closed,Suspicious Activity,003329,,
PSHI-2026-02-I-133703,02/11/2026 12:40 PM,02/11/2026 12:16 PM,Hershey - Dispatched To: HMC - Main Hospital - 4 - Acute Care > HMC - Main Hospital - 4 - Acute Care,Assisted clinical staff with agitated patient.,Closed,Patient Assist/Restraint-Hold,003329,,
PSHI-2026-02-I-133702,02/11/2026 12:13 PM,02/11/2026 10:55 AM,Hershey - Dispatched To: HMC - Main Hospital - 4 - Acute Care > HMC - Main Hospital - 4 - Acute Care,Assisted clinical staff with agitated patient.,Closed,Patient Assist/Stand By,003329,,
26AB00071,02/11/2026 12:08 PM,02/11/2026 12:08 PM,LOT G - ABINGTON,Employee reported a parking concern,Closed,End occurred: 02/11/2026 12:30 PM VEHICLE CODE VIOLATION VEHICLE CODE OTHER,003329,,
26MA00002,02/11/2026 12:05 PM,02/09/2026 07:40 PM,MULTI-PURPOSE ACTIVITIES CENTER,Employee requested assistance with an administrative matter,Closed,End occurred: 02/10/2026 12:35 AM RFA OTHER,003329,,
PSHI-2026-02-I-133699,02/11/2026 11:19 AM,,Hershey - Dispatched To: HMC - UPC-2 - 2 - Medicine Suite > HMC - UPC-2 - 2 - Medicine Suite,Investigated suspicious activity.,Closed,Suspicious Activity,003329,,
26HN00015,02/11/2026 11:15 AM,02/11/2026 11:15 AM,PA-93 & WOODBINE ST,Assisted an outside law enforcement agency with an investigation,Closed,End occurred: 02/11/2026 12:05 PM ASSIST OTHER LE AGENCY no UCR,003329,,
PSHI-2026-02-I-133698,02/11/2026 11:10 AM,02/11/2026 10:41 PM,Hershey - Dispatched To: HMC - Main Hospital > HMC - Main Hospital,Property damage,Closed,Patient Assist/Verbal Assist,003329,,
