Number,Reported_Date_Time,Occurred_From_Date_Time,Location,Description,Disposition,Narrative,School_Code,latitude,longitude
26AL00027,01/18/2026 09:20 AM,01/18/2026 09:20 AM,E WOPSONONOCK AVE & IVYSIDE DR,Assisted the fire department with a hazardous condition,Closed,End occurred: 01/18/2026 09:30 AM RFA FIRE ASSIST HEALTH AND SAFETY,003329,,
26AL00026,01/18/2026 05:59 AM,01/18/2026 05:59 AM,CEDAR HALL,Student observed highly intoxicated and transported to the hospital,Exceptional Clearance-Adult,End occurred: 01/18/2026 06:38 AM LIQUOR LAW VIOLS HEALTH AND SAFETY RFA AMBULANCE ASSIST,003329,,
26UP00273,01/18/2026 02:18 AM,01/18/2026 02:18 AM,AIRPORT AIR TERMINAL BLDG,Employee reported being physically assaulted by a known person,Cleared by Adult Arrest,"End occurred: 01/18/2026 07:24 AM CRIMINAL MISCHIEF AGG ASSAULT, KNIFE/CUTTING SIMPLE/OTHER ASSAULT, NOT AGG SIMPLE/OTHER ASSAULT, NOT AGG SUSPICIOUS ACTIVITY RFA AMBULANCE ASSIST HEALTH AND SAFETY HEALTH AND SAFETY DISORDERLY CONDUCT SIMPLE/OTHER ASSAULT, NOT AGG AGG ASSAULT-POLICE-KNIFE/CUT AGG ASSAULT, KNIFE/CUTTING SIMPLE/OTHER ASSAULT, NOT AGG SIMPLE/OTHER ASSAULT, NOT AGG",003329,,
26HB00015,01/18/2026 01:58 AM,01/18/2026 01:58 AM,JUNIATA HOUSE,Assisted the ambulance with a medical emergency,Closed,End occurred: 01/18/2026 02:48 AM HEALTH AND SAFETY RFA AMBULANCE ASSIST,003329,,
26UP00271,01/18/2026 01:42 AM,01/16/2026 02:00 AM,SOUTH HALLS RESIDENCE COMPLEX,Student reported they were sexually assaulted by a known person in a residence hall,Open,"RAPE SEX OFFENSES - (11D) AGG ASSAULT, HANDS/FIST/FEET",003329,,
26UP00270,01/18/2026 01:27 AM,01/18/2026 01:27 AM,MCKEE HALL,Student observed highly intoxicated and transported to the hospital,Exceptional Clearance-Adult,End occurred: 01/18/2026 02:10 AM HEALTH AND SAFETY LIQUOR LAW VIOLS RFA AMBULANCE ASSIST,003329,,
26UP00269,01/18/2026 01:13 AM,01/18/2026 01:13 AM,MCKEAN HALL,"Resident Assistant reported the odor of marijuana, origin not located",Closed,End occurred: 01/18/2026 01:27 AM HEALTH AND SAFETY,003329,,
26UP00268,01/18/2026 01:02 AM,01/18/2026 12:19 AM,SHORTLIDGE RD & E COLLEGE AVE,Student observed highly intoxicated,Cleared by Adult Arrest,End occurred: 01/18/2026 12:39 AM PUBLIC DRUNKENNESS LIQUOR LAW VIOLS FORG/CNTFT MANF CARRY FALSE ID,003329,,
PSHI-2026-01-I-132802,01/18/2026 12:11 AM,01/17/2026 08:10 PM,Hershey - Dispatched To: HMC - Emergency Department > HMC - Emergency Department,Patient scratched staff member.,Closed,"Assault/Aggravated-Hands, Fist, Feet",003329,,
26BK00008,01/18/2026 12:11 AM,01/18/2026 12:11 AM,LAUREL HALL,Student reported a fire alarm activation,Closed,End occurred: 01/18/2026 12:00 AM ALARMS,003329,,
26BK00009,01/18/2026 12:11 AM,01/18/2026 12:11 AM,LAUREL HALL,Student found in possession of alcoholic beverages being less than 21 years of age,Not Cleared,End occurred: 01/18/2026 12:45 AM LIQUOR LAW VIOLS,003329,,
26ER00015,01/18/2026 12:00 AM,01/18/2026 12:00 AM,ALMY LOT - ERIE,Officers responded to a 911 hang-up with no voice contact,Closed,End occurred: 01/18/2026 12:15 AM HEALTH AND SAFETY,003329,,
26UP00266,01/17/2026 11:49 PM,01/17/2026 11:49 PM,SIMMONS HALL,Resident Assistant reported the odor of marijuana,Cleared by Adult Arrest,End occurred: 01/18/2026 12:42 AM POSS MARIJUANA ALL OT POSS DRUG PARAPHERNALIA RULES AND REGULATIONS,003329,,
26UP00264,01/17/2026 11:28 PM,01/17/2026 11:28 PM,MIFFLIN HALL,"Employee reported the odor of marijuana, origin not located",Closed,End occurred: 01/17/2026 11:45 PM HEALTH AND SAFETY RULES AND REGULATIONS,003329,,
26UP00267,01/17/2026 11:23 PM,01/17/2026 11:23 PM,BIGLER RD & MILLENNIUM DR,Visitor observed highly intoxicated and transported to the hospital,Cleared by Adult Arrest,End occurred: 01/18/2026 12:03 AM LIQUOR LAW VIOLS PUBLIC DRUNKENNESS FORG/CNTFT MANF CARRY FALSE ID HEALTH AND SAFETY RFA AMBULANCE ASSIST,003329,,
26UP00261,01/17/2026 10:59 PM,01/17/2026 10:59 PM,BEAVER STADIUM,Assisted the fire department with a reported fire alarm activation,Closed,End occurred: 01/17/2026 11:13 PM RFA FIRE ASSIST ALARMS,003329,,
PSHI-2026-01-I-132795,01/17/2026 10:07 PM,01/17/2026 06:51 PM,Hershey - Dispatched To: HMC - Main Hospital - 7 - Medical Intensive Care Unit West (MICU) > HMC - Main Hospital - 7 - Medical Intensive Care Unit West (MICU),Assisted staff member with domestic problem.,Closed,Staff Assist,003329,,
26UP00247,01/17/2026 05:59 PM,01/17/2026 05:59 PM,FOOTBALL LOT,Student stopped for a University policy violation regarding fireworks,Closed,RULES AND REGULATIONS,003329,,
PSHI-2026-01-I-132789,01/17/2026 05:48 PM,01/17/2026 05:29 PM,Hershey - Dispatched To: HMC - Children's Hospital > HMC - Children's Hospital,Team de-escalation plan for agitated patient.,Closed,Patient Assist/Restraint-Hold,003329,,
26AB00013,01/17/2026 05:15 PM,01/17/2026 05:15 PM,RYDAL EXECUTIVE PLAZA,Visitor reported a fire/burglar alarm communication failure,Closed,End occurred: 01/17/2026 05:30 PM ALARMS,003329,,
26AB00012,01/17/2026 03:23 PM,01/17/2026 03:23 PM,CLOVERLY LN & SEWELL LN,Student reported a one vehicle crash with no injuries,Closed,End occurred: 01/17/2026 04:09 PM VEHICLE CODE ACCIDENT,003329,,
PSHI-2026-01-I-132787,01/17/2026 03:21 PM,01/17/2026 02:45 PM,Hershey - Dispatched To: HMC - Emergency Department > HMC - Emergency Department,Assisted LE with investigation of crime that occurred in a different county.,Closed,Law Enforcement Assist,003329,,
26AB00011,01/17/2026 02:09 PM,01/17/2026 02:09 PM,LIONS GATE AT PENN STATE ABINGTON,Employee reported a fire alarm activation,Closed,End occurred: 01/17/2026 02:29 PM ALARMS,003329,,
26AL00025,01/17/2026 01:19 PM,01/17/2026 01:19 PM,MAPLE HALL,Student reported a suspicious odor,Closed,End occurred: 01/17/2026 01:32 PM HEALTH AND SAFETY,003329,,
PSHI-2026-01-I-132783,01/17/2026 01:12 PM,01/17/2026 11:47 AM,Hershey - Dispatched To: HMC - UPC-1 > HMC - UPC-1,Assisted maintenance with locating faulty equipment,Closed,Fire/Fire Hazard,003329,,
26UP00242,01/17/2026 11:46 AM,01/17/2026 11:46 AM,AIRPORT AIR TERMINAL BLDG,Officer observed a employee trespassing inside a University building,Exceptional Clearance-Adult,End occurred: 01/17/2026 02:43 PM ALL OT CRIMINAL TRESPASS,003329,,
26UP00243,01/17/2026 11:33 AM,01/13/2026 07:00 PM,HUB ROBESON CULTURAL CENTER,Student reported suspicious persons,Closed,End occurred: 01/17/2025 11:15 AM SUSPICIOUS ACTIVITY,003329,,
PSHI-2026-01-I-132780,01/17/2026 11:25 AM,01/17/2026 09:03 AM,Hershey - Dispatched To: HMC - Emergency Department > HMC - Emergency Department,Victim of violence receiving treatment.,Closed,Violence Victim,003329,,
26UP00241,01/17/2026 07:15 AM,01/17/2026 07:15 AM,AIRPORT GENERAL AVIATION ADMINISTRATION BLDG,Employee reported suspicious person,Cleared by Adult Arrest,End occurred: 01/17/2026 10:00 AM SUSPICIOUS ACTIVITY HEALTH AND SAFETY ALL OT CRIMINAL TRESPASS,003329,,
PSHI-2026-01-I-132771,01/17/2026 05:24 AM,01/17/2026 05:10 AM,Hershey - Dispatched To: HMC - Parking Lot - Lot UPC > HMC - Parking Lot - Lot UPC,Inspection of leased equipment.,Closed,Property Related Matter/Valuables,003329,,
26AL00023,01/17/2026 04:17 AM,01/17/2026 04:17 AM,MAPLE HALL,Employee reported a fire alarm activation,Closed,ALARMS HEALTH AND SAFETY,003329,,
PSHI-2026-01-I-132769,01/17/2026 04:07 AM,01/16/2026 08:26 PM,Hershey - Dispatched To: COM - University Manor East > COM - University Manor East,False fire alarm.,Closed,Fire/Fire Hazard,003329,,
26UP00240,01/17/2026 03:56 AM,01/17/2026 03:56 AM,ATHERTON HALL,Underage visitor observed highly intoxicated and transported to the hospital,Exceptional Clearance-Juvenile,End occurred: 01/17/2026 05:07 AM LIQUOR LAW VIOLS HEALTH AND SAFETY RFA AMBULANCE ASSIST,003329,,
26UP00239,01/17/2026 03:54 AM,01/17/2026 03:54 AM,PENNYPACKER HALL,Student reported a concern for another student,Exceptional Clearance-Adult,End occurred: 01/17/2026 05:17 AM RFA ATTEMPT TO LOCATE HEALTH AND SAFETY HEALTH AND SAFETY RFA AMBULANCE ASSIST LIQUOR LAW VIOLS,003329,,
26UP00236,01/17/2026 02:24 AM,01/17/2026 02:24 AM,PORTER HALL,"Employee reported the odor of marijuana, origin not located",Closed,End occurred: 01/17/2026 02:34 AM ALARMS HEALTH AND SAFETY,003329,,
26UP00234,01/17/2026 02:20 AM,01/17/2026 01:55 AM,BIGLER RD & MILLENNIUM DR,Student consumed alcoholic beverages being less than 21 years of age,Cleared by Adult Arrest,DISORDERLY CONDUCT LIQUOR LAW VIOLS FORG/CNTFT MANF CARRY FALSE ID,003329,,
26UP00235,01/17/2026 02:15 AM,01/17/2026 02:15 AM,PENNYPACKER HALL,Student reported damage to University property,Not Cleared,End occurred: 01/17/2026 02:33 AM CRIMINAL MISCHIEF,003329,,
26AL00022,01/17/2026 02:10 AM,01/17/2026 02:10 AM,CAMPUS VIEW DR,Assisted an outside law enforcement agency with an investigation,Closed,End occurred: 01/17/2026 02:30 AM ASSIST OTHER LE AGENCY no UCR,003329,,
PSHI-2026-01-I-132766,01/17/2026 02:00 AM,01/17/2026 01:12 AM,Hershey - Dispatched To: HMC - Main Hospital > HMC - Main Hospital,Assisted clinical staff with agitated patient.,Closed,Patient Assist/Verbal Assist,003329,,
26UP00233,01/17/2026 01:50 AM,01/17/2026 01:48 AM,MIFFLIN RD & MCKEAN RD,Student reported disorderly persons,Not Cleared,"End occurred: 01/17/2026 01:50 AM DISORDERLY CONDUCT PUBLIC DRUNKENNESS SIMPLE/OTHER ASSAULT, NOT AGG",003329,,
PSHI-2026-01-I-132763,01/16/2026 11:48 PM,01/16/2026 08:49 PM,Hershey - Dispatched To: HMC - Main Hospital - 2 - Main PACU > HMC - Main Hospital - 2 - Main PACU,Assisted clinical staff with agitated patient.,Closed,Behavioral De-escalation Team (BDRT) (BERT),003329,,
PSHI-2026-01-I-132762,01/16/2026 10:34 PM,01/16/2026 09:06 PM,Hershey - Dispatched To: HMC - Main Hospital - 2 - Main PACU > HMC - Main Hospital - 2 - Main PACU,Assisted clinical staff with agitated patient.,Closed,Behavioral De-escalation Team (BDRT) (BERT),003329,,
26UP00221,01/16/2026 10:20 PM,01/16/2026 10:20 PM,W COLLEGE AVE & N BARNARD ST,Identified occupant in possession of marijuana,Not Cleared,End occurred: 01/16/2026 11:06 PM VEHICLE CODE VIOLATION VEHICLE CODE VIOLATION POSS MARIJUANA,003329,,
26UP00218,01/16/2026 09:29 PM,01/16/2026 09:29 PM,MILLER HALL,Identified occupant in possession of marijuana and drug paraphernalia,Open,End occurred: 01/16/2026 10:08 PM POSS MARIJUANA ALL OT POSS DRUG PARAPHERNALIA,003329,,
26UP00215,01/16/2026 08:08 PM,01/16/2026 08:08 PM,LION SHRINE LOT,Employee reported a two vehicle crash with no injuries,Closed,End occurred: 01/16/2026 08:18 PM VEHICLE CODE ACCIDENT,003329,,
26UP00216,01/16/2026 07:55 PM,01/16/2026 07:55 PM,VILLAGE DR,Visitor reported a suspicious vehicle,Closed,End occurred: 01/16/2026 08:30 PM SUSPICIOUS ACTIVITY,003329,,
26UP00213,01/16/2026 06:59 PM,01/16/2026 06:59 PM,MILLER HALL,Assisted a student with a personal matter,Closed,End occurred: 01/16/2026 08:25 PM HEALTH AND SAFETY HEALTH AND SAFETY RFA ATTEMPT TO LOCATE RFA AMBULANCE ASSIST,003329,,
26UP00212,01/16/2026 06:27 PM,01/16/2026 02:30 PM,HOYT HALL,Student reported suspicious activity,Not Cleared,End occurred: 01/16/2026 07:37 PM FRAUD IMPERSONATE PUBL SERVANT FRAUD THEFT BY DECEPTION,003329,,
26UP00209,01/16/2026 05:11 PM,01/16/2026 05:00 PM,CHAMBERS BLDG,Employee reported suspicious persons,Closed,End occurred: 01/16/2026 05:42 PM SUSPICIOUS ACTIVITY,003329,,
26HB00012,01/16/2026 04:28 PM,01/16/2026 04:28 PM,PAXTON HOUSE,Employee reported a fire alarm activation,Closed,ALARMS,003329,,
PSHI-2026-01-I-132749,01/16/2026 03:43 PM,01/16/2026 03:44 PM,Hershey - Dispatched To: HMC - Main Hospital > HMC - Main Hospital,Assisted clinical staff with agitated visitor.,Closed,Visitor Problem,003329,,
PSHI-2026-01-I-132748,01/16/2026 03:41 PM,,Hershey - Dispatched To: HMC - Main Hospital > HMC - Main Hospital,Assisted clinical staff with agitated patient.,Closed,Staff Assist,003329,,
26UP00204,01/16/2026 03:25 PM,01/16/2026 03:25 PM,UNIVERSITY SUPPORT BLDG I,Officer conducted a pre-employment background investigation,Open,DEPARTMENT INFO,003329,,
26UP00203,01/16/2026 03:07 PM,01/16/2026 03:07 PM,COMMUTER JORDAN EAST 1 LOT,Student reported a hit and run vehicle crash,Closed,End occurred: 01/16/2026 03:52 PM RFA OTHER VEHICLE CODE ACCIDENT,003329,,
PSHI-2026-01-I-132746,01/16/2026 02:51 PM,01/16/2026 11:39 AM,Hershey - Dispatched To: HMC - Main Hospital > HMC - Main Hospital,Assisted staff with locating ultrasound machine.,Closed,Property Related Matter/Lost and Found,003329,,
PSHI-2026-01-I-132745,01/16/2026 02:45 PM,01/16/2026 01:24 PM,Hershey - Dispatched To: HMC - Main Hospital > HMC - Main Hospital,Facility AED inspection.,Closed,Facility Infrastructure Inspection,003329,,
26UP00201,01/16/2026 01:49 PM,01/16/2026 01:49 PM,UNIVERSITY SUPPORT BLDG I,Assisted an outside law enforcement agency with an investigation,Closed,End occurred: 01/16/2026 02:10 PM ASSIST OTHER LE AGENCY no UCR,003329,,
26UP00202,01/16/2026 01:45 PM,01/16/2026 06:20 AM,WHITE BLDG,Student reported being harassed,Not Cleared,End occurred: 01/16/2026 07:10 AM DC HARASSMENT DC STALKING,003329,,
26AL00021,01/16/2026 01:27 PM,01/16/2026 01:27 PM,OAK LOT - BOA - ALTOONA,Employee reported a parking concern,Closed,End occurred: 01/16/2026 01:45 PM RULES AND REGULATIONS,003329,,
26AL00020,01/16/2026 01:20 PM,01/16/2026 01:10 PM,OAK HALL,Employee reported a fire alarm activation,Closed,End occurred: 01/16/2026 01:25 PM ALARMS,003329,,
26UP00200,01/16/2026 12:43 PM,01/13/2026 03:09 PM,NITTANY PARKING,Employee reported a one vehicle crash with no injuries,Closed,VEHICLE CODE ACCIDENT,003329,,
PSHI-2026-01-I-132736,01/16/2026 12:36 PM,01/16/2026 12:17 PM,Hershey - Dispatched To: HMC - Emergency Department > HMC - Emergency Department,Assisted clinical staff with agitated visitor.,Closed,Visitor Problem,003329,,
26UP00305,01/16/2026 12:23 PM,01/16/2026 12:23 PM,SHUNK HALL,Assisted the ambulance with a medical emergency,Not Cleared,End occurred: 01/16/2026 12:54 PM FORG/CNTFT MANF CARRY FALSE ID HEALTH AND SAFETY RFA AMBULANCE ASSIST,003329,,
26UP00199,01/16/2026 12:22 PM,01/15/2026 01:35 AM,POLLOCK HALLS RESIDENCE COMPLEX,Student reported a person trespassing inside a residence hall room,Cleared by Adult Arrest,End occurred: 01/15/2026 01:40 AM DISORDERLY CONDUCT ALL OT CRIMINAL TRESPASS SUSPICIOUS ACTIVITY DISORDERLY CONDUCT SEX OFFENSES - (NOT CLERY),003329,,
26BR00001,01/16/2026 12:00 PM,01/14/2026 02:00 PM,BAKER ENGINEERING & SCIENCE BUILDING,Employee reported damage to University property,Open,End occurred: 01/16/2026 12:00 PM CRIMINAL MISCHIEF,003329,,
26SL00003,01/16/2026 12:00 PM,01/14/2026 11:58 AM,HEALTH & WELLNESS BUILDING,Assisted a student with a personal matter,Closed,RFA ASSIST OTHER AGENCY/DEPT HEALTH AND SAFETY,003329,,
PSHI-2026-01-I-132735,01/16/2026 11:11 AM,01/16/2026 10:02 AM,Hershey - Dispatched To: HMC - Main Hospital > HMC - Main Hospital,Turned over pipe to police who declined to charge suspect.,Closed,Drug Offense/Paraphernalia,003329,,
26ER00014,01/16/2026 10:06 AM,01/16/2026 10:03 AM,JORDAN RD & COLLEGE DR,Student reported a two vehicle crash with no injuries,Closed,VEHICLE CODE ACCIDENT,003329,,
26WS00001,01/16/2026 10:00 AM,01/16/2026 10:00 AM,MULTI-PURPOSE BUILDING,Employee requested assistance with an administrative matter,Open,End occurred: 01/16/2026 11:00 AM RFA ASSIST OTHER AGENCY/DEPT,003329,,
PSHI-2026-01-I-132732,01/16/2026 09:57 AM,01/16/2026 09:02 AM,Hershey - Dispatched To: HMC - Children's Hospital > HMC - Children's Hospital,Assisted clinical staff with agitated patient.,Closed,Patient Assist/Escort,003329,,
PSHI-2026-01-I-132728,01/16/2026 09:25 AM,01/16/2026 08:26 AM,Hershey - Reported Location: HMC - Emergency Department,Assisted LE with inbound combative patient.,Closed,Law Enforcement Assist,003329,,
26AL00018,01/16/2026 09:00 AM,01/16/2026 09:00 AM,HAWTHORN LOT - ALTOONA,Employee reported found property,Closed,FOUND PROPERTY,003329,,
26UP00198,01/16/2026 05:53 AM,01/16/2026 05:53 AM,BEAVER STADIUM,Assisted the fire department with a reported fire alarm activation,Closed,End occurred: 01/16/2026 06:15 AM RFA FIRE ASSIST ALARMS,003329,,
26UP00197,01/16/2026 04:35 AM,01/16/2026 03:35 AM,BEAM HALL,Underage student observed highly intoxicated and transported to the hospital,Cleared by Adult Arrest,End occurred: 01/16/2026 05:14 AM ALL OT CRIMINAL TRESPASS CRIMINAL MISCHIEF LIQUOR LAW VIOLS DISORDERLY CONDUCT,003329,,
26UP00195,01/16/2026 02:26 AM,01/16/2026 02:26 AM,UNIVERSITY SUPPORT BLDG I,Conducted a pre-employment background investigation,Open,End occurred: 01/16/2026 02:30 AM DEPARTMENT INFO,003329,,
26UP00196,01/16/2026 02:08 AM,01/16/2026 12:00 AM,HIBBS HALL,Student consumed alcoholic beverages being less than 21 years of age,Exceptional Clearance-Adult,End occurred: 01/16/2026 03:19 AM HEALTH AND SAFETY RFA ATTEMPT TO LOCATE LIQUOR LAW VIOLS,003329,,
PSHI-2026-01-I-132719,01/16/2026 12:22 AM,,Hershey - Dispatched To: HMC - Main Hospital > HMC - Main Hospital,Assisted clinical staff with an agitated patient.,Closed,Patient Assist/Stand By,003329,,
26UP00193,01/16/2026 12:01 AM,01/16/2026 12:01 AM,SHULZE HALL,Assisted the fire department with a reported fire alarm activation,Closed,End occurred: 01/16/2025 12:35 AM HEALTH AND SAFETY RFA FIRE ASSIST,003329,,
26UP00188,01/15/2026 10:57 PM,01/12/2026 05:35 PM,UNKNOWN LOCATION,Employee reported being harassed,Not Cleared,End occurred: 01/12/2025 05:35 PM DC HARASSMENT,003329,,
PSHI-2026-01-I-132715,01/15/2026 09:50 PM,01/15/2026 08:50 PM,Hershey - Dispatched To: HMC - Children's Hospital > HMC - Children's Hospital,Assisted clinical staff with agitated patient.,Closed,Patient Assist/Restraint-Hold,003329,,
PSHI-2026-01-I-132714,01/15/2026 09:43 PM,01/15/2026 07:31 PM,Hershey - Dispatched To: HMC - Children's Hospital - 1 > HMC - Children's Hospital - 1,Assisted clinical staff with an agitated patient.,Closed,Patient Assist/Stand By,003329,,
PSHI-2026-01-I-132713,01/15/2026 09:30 PM,01/15/2026 06:48 PM,Hershey - Dispatched To: HMC - Main Hospital > HMC - Main Hospital,Assisted clinical staff with an agitated patient.,Closed,Patient Assist/Violent Restraints,003329,,
PSHI-2026-01-I-132711,01/15/2026 08:42 PM,01/15/2026 08:25 PM,Hershey - Dispatched To: HMC - Emergency Department > HMC - Emergency Department,Safekeeping of patient knife.,Closed,Safekeeping of Weapons,003329,,
26UP00173,01/15/2026 06:54 PM,01/15/2026 03:00 PM,UNKNOWN LOCATION,Student reported being harassed,Unfounded,End occurred: 01/15/2026 06:30 PM DC HARASSMENT,003329,,
26UP00174,01/15/2026 06:16 PM,07/15/2025 06:16 PM,SPROUL HALL,Student reported being harassed,Not Cleared,End occurred: 01/15/2026 07:45 PM DC HARASSMENT,003329,,
PSHI-2026-01-I-132703,01/15/2026 05:43 PM,01/15/2026 02:55 PM,Hershey - Dispatched To: HMC - Main Hospital - 6 - MIMCU > HMC - Main Hospital - 6 - MIMCU,Assisted clinical staff with an agitated visitor.,Closed,Patient Assist/Stand By,003329,,
26ER00013,01/15/2026 05:37 PM,01/15/2026 05:37 PM,SMITH CHAPEL & CARILLON,Employee reported an alarm activation,Closed,End occurred: 01/15/2026 05:50 PM ALARMS,003329,,
26UP00168,01/15/2026 04:45 PM,10/31/2025 11:00 PM,SOUTH HALLS RESIDENCE COMPLEX,Student reported they were sexually assaulted by a known person in a residence hall,Open,End occurred: 11/01/2025 12:00 AM RAPE,003329,,
26UP00164,01/15/2026 04:27 PM,12/28/2025 04:27 PM,UNIVERSITY SUPPORT BLDG I,Student reported suspicious persons,Open,End occurred: 12/28/2025 06:00 PM SUSPICIOUS ACTIVITY,003329,,
26UP00166,01/15/2026 04:27 PM,01/15/2026 04:27 PM,SNYDER HALL,Student found in possession of alcoholic beverages being less than 21 years of age,Not Cleared,End occurred: 01/15/2026 04:37 PM LIQUOR LAW VIOLS RULES AND REGULATIONS ALARMS,003329,,
PSHI-2026-01-I-132693,01/15/2026 03:40 PM,01/15/2026 02:43 PM,Hershey - Dispatched To: HMC - Main Hospital - 1 - Cashier's Office > HMC - Main Hospital - 1 - Cashier's Office,Assisted courier with deposit into treasury.,Closed,Property Related Matter/Valuables,003329,,
PSHI-2026-01-I-132694,01/15/2026 03:40 PM,01/15/2026 03:11 PM,Hershey - Dispatched To: HMC - Children's Hospital - 6 > HMC - Children's Hospital - 6,Assisted clinical staff with an agitated patient.,Closed,Patient Assist/Restraint-Hold,003329,,
26HB00010,01/15/2026 02:29 PM,01/15/2026 02:29 PM,OLMSTED BUILDING,Assisted the ambulance with a medical emergency,Closed,End occurred: 01/15/2026 03:00 PM HEALTH AND SAFETY RFA AMBULANCE ASSIST,003329,,
PSHI-2026-01-I-132689,01/15/2026 02:15 PM,01/15/2026 01:22 PM,Hershey - Dispatched To: HMC - Main Hospital - 4 > HMC - Main Hospital - 4,Assisted clinical staff with agitated patient.,Closed,Patient Assist/Restraint-Hold,003329,,
PSHI-2026-01-I-132687,01/15/2026 02:09 PM,01/15/2026 01:56 PM,Hershey - Dispatched To: HMC - Emergency Department > HMC - Emergency Department,Assisted clinical staff with agitated visitor.,Closed,Visitor Problem,003329,,
PSHI-2026-01-I-132686,01/15/2026 02:02 PM,01/15/2026 12:18 PM,Hershey - Dispatched To: HMC - Children's Hospital - 1 - Children's Hospital Main Information Desk > HMC - Children's Hospital - 1 - Children's Hospital Main Information Desk,Visitor mismatch on the sex offender registry.,Closed,Sex Offender Registry/False,003329,,
PSHI-2026-01-I-132685,01/15/2026 02:02 PM,01/15/2026 01:10 PM,Hershey - Dispatched To: HMC - Children's Hospital - 1 - Children's Hospital Main Information Desk > HMC - Children's Hospital - 1 - Children's Hospital Main Information Desk,Visitor mismatch to the sex offender registry.,Closed,Sex Offender Registry/False,003329,,
PSHI-2026-01-I-132681,01/15/2026 01:45 PM,,Hershey - Dispatched To: HMC - Main Hospital - 4 > HMC - Main Hospital - 4,Assisted clinical staff with agitated patient.,Closed,Patient Assist/Restraint-Hold,003329,,
26AL00017,01/15/2026 01:33 PM,01/15/2026 01:33 PM,OAK HALL,Employee reported a fire alarm activation,Closed,End occurred: 01/15/2026 01:45 PM ALARMS,003329,,
26UP00160,01/15/2026 01:20 PM,01/12/2026 08:00 PM,EARLE HALL,Student reported the loss or theft of their unattended personal property,Not Cleared,"End occurred: 01/13/2026 09:00 PM THEFT, FROM BUILDING",003329,,
PSHI-2026-01-I-132679,01/15/2026 01:19 PM,01/15/2026 10:05 AM,Hershey - Dispatched To: HMC - Main Hospital > HMC - Main Hospital,Assisted staff with an agitated visitor.,Closed,Visitor Problem,003329,,
26BK00006,01/15/2026 01:17 PM,01/15/2026 01:17 PM,IVY HALL,Employee reported a fire alarm activation,Closed,End occurred: 01/15/2026 01:30 PM ALARMS,003329,,
26BW00005,01/15/2026 12:55 PM,11/26/2025 12:01 AM,VAIRO LIBRARY,Employee reported the loss of University property,Closed,End occurred: 01/15/2026 12:55 PM LOST PROPERTY,003329,,
26UP00159,01/15/2026 12:17 PM,01/15/2026 11:17 AM,ORANGE F MORGAN CENTER LOT,Employee reported a two vehicle crash with no injuries,Closed,End occurred: 01/15/2026 12:17 PM VEHICLE CODE ACCIDENT,003329,,
26DS00001,01/15/2026 12:16 PM,01/15/2026 12:16 PM,N 6TH ST & E DUBOIS AVE,Visitor requested assistance with a disabled vehicle,Closed,End occurred: 01/15/2026 12:22 PM RFA DISABLED VEHICLE,003329,,
PSHI-2026-01-I-132677,01/15/2026 12:08 PM,01/15/2026 10:52 AM,Hershey - Dispatched To: HMC - Main Hospital  > HMC - Main Hospital,Visitor harassed staff member.,Closed,Harassment/General,003329,,
26UP00158,01/15/2026 10:59 AM,01/15/2026 10:59 AM,WEST DECK,Employee reported a one vehicle crash with no injuries,Closed,End occurred: 01/15/2026 11:30 AM VEHICLE CODE ACCIDENT,003329,,
PSHI-2026-01-I-132676,01/15/2026 10:58 AM,01/15/2026 10:17 AM,Hershey - Dispatched To: HMC - Main Hospital - 4 > HMC - Main Hospital - 4,Team de-escalation plan for agitated patient.,Closed,Patient Assist/Stand By,003329,,
PSHI-2026-01-I-132674,01/15/2026 10:46 AM,01/15/2026 10:19 AM,Hershey - Dispatched To: HMC - Main Hospital - 4 > HMC - Main Hospital - 4,Assisted clinical staff with an agitated patient.,Closed,Patient Assist/Escort,003329,,
PSHI-2026-01-I-132675,01/15/2026 10:46 AM,01/15/2026 10:01 AM,Hershey - Dispatched To: HMC - Main Hospital - 2 - Same Day Surgery Unit > HMC - Main Hospital - 2 - Same Day Surgery Unit,Assisted LE with removal of restraints.,Closed,Law Enforcement Assist,003329,,
26UP00157,01/15/2026 10:26 AM,01/13/2026 07:13 PM,HUB PARKING DECK,Employee reported theft of services,Not Cleared,End occurred: 01/15/2026 10:16 AM FRAUD THEFT OF SERVICES,003329,,
26WB00002,01/15/2026 10:12 AM,01/14/2026 02:00 PM,ATHLETIC AND RECREATION BUILDING,Employee requested assistance with an administrative matter,Closed,End occurred: 01/15/2026 10:12 AM RFA OTHER HEALTH AND SAFETY,003329,,
26UP00155,01/15/2026 09:19 AM,12/15/2025 09:19 AM,UNIVERSITY SUPPORT BLDG I,Employee reported suspicious persons,Closed,End occurred: 01/07/2026 07:00 AM DEPARTMENT INFO SUSPICIOUS ACTIVITY,003329,,
26HB00009,01/15/2026 09:00 AM,01/14/2026 08:00 AM,SUSQUEHANNA BUILDING,Student reported being harassed,Not Cleared,End occurred: 01/15/2026 09:15 AM DC HARASSMENT,003329,,
PSHI-2026-01-I-132673,01/15/2026 09:00 AM,01/15/2026 07:37 AM,Hershey - Dispatched To: HMC - Children's Hospital - 6 > HMC - Children's Hospital - 6,Assisted clinical staff with agitated patient.,Closed,Patient Assist/Restraint-Hold,003329,,
PSHI-2026-01-I-132672,01/15/2026 08:33 AM,01/15/2026 08:11 AM,Hershey - Dispatched To: HMC - Main Hospital - 4 > HMC - Main Hospital - 4,Assisted clinical staff with agitated patient.,Closed,Patient Assist/Restraint-Hold,003329,,
26BK00007,01/15/2026 07:30 AM,01/15/2026 07:30 AM,BEAVER ATHLETICS AND WELLNESS CENTER,Employee reported a suspicious item,Closed,SUSPICIOUS ACTIVITY,003329,,
PSHI-2026-01-I-132668,01/15/2026 05:44 AM,01/15/2026 05:12 AM,Hershey - Dispatched To: HMC - Main Hospital - 4 - Acute Care > HMC - Main Hospital - 4 - Acute Care,Assisted clinical staff with agitated patient.,Closed,Patient Assist/Stand By,003329,,
26UP00154,01/15/2026 02:39 AM,01/15/2026 02:39 AM,MCKEAN RD & SHORTLIDGE RD,Student observed highly intoxicated,Cleared by Adult Arrest,End occurred: 01/15/2026 03:16 AM PUBLIC DRUNKENNESS LIQUOR LAW VIOLS RFA AMBULANCE ASSIST HEALTH AND SAFETY,003329,,
